{
  "ticker": "TSLA",
  "price": 439.74,
  "currency": "USD",
  "summary": "Tesla (TSLA)는 전기차 및 에너지 사업을 영위하며, 최근 SpaceX와의 잠재적 합병 논의와 로봇택시, Optimus 로봇 등 AI 및 로보틱스로의 사업 확장이 주요 동력으로 부상하고 있습니다. 2025년 4분기 실적은 예상치를 상회했으나, 연간 매출 감소 및 차량 인도량 둔화, 높은 자본 지출 우려 등 단기적인 리스크 또한 상존합니다. 주가는 높은 변동성을 보이며, 광범위한 시장의 탐욕 지수 속에서 혼조세를 띠고 있습니다.",
  "sentimentScore": 50,
  "fearGreedIndex": 63.31,
  "targetPrice": 409.58,
  "investmentRating": "Buy",
  "technicalSignal": "Neutral",
  "riskLevel": "High",
  "reasons": [
    "AI 및 로보틱스(Optimus, 로봇택시) 사업으로의 확장 기대감에 따른 투자심리 개선.",
    "SpaceX와의 잠재적 합병 논의 보도로 인한 미래 성장 동력 확보 기대.",
    "전기차 시장 경쟁 심화 및 가격 인하 압력 지속으로 인한 마진 감소 우려.",
    "2025년 연간 매출 감소 및 차량 인도량 둔화가 실적에 미치는 부정적 영향.",
    "기술적 지표는 단기적으로 혼조세(RSI 중립, 이동평균선 매도 신호)를 나타냄."
  ],
  "scenarios": {
    "bull": "자율주행 및 로보틱스 기술(Robotaxi, Optimus)의 성공적인 개발 및 상용화, SpaceX와의 시너지 창출, 신규 저가형 모델 출시를 통한 시장 점유율 확대, 배터리 기술 혁신을 통한 원가 경쟁력 확보로 견조한 성장세 회복 시 주가 상승 가능성이 높습니다.",
    "bear": "전기차 시장의 경쟁 심화와 수요 둔화로 인한 추가적인 가격 인하 및 마진 압박, AI 및 로보틱스 프로젝트의 지연 또는 기대치 미달, 글로벌 경기 둔화 및 공급망 문제 장기화로 인한 생산 및 인도량 차질이 발생할 경우 주가 하락 압력이 커질 수 있습니다."
  },
  "technicalAnalysis": {
    "support": 420,
    "resistance": 442.9,
    "trend": "횡보",
    "details": "TSLA는 현재 $420~$445 범위 내에서 횡보하는 움직임을 보이고 있습니다. 14일 RSI는 49.537로 중립적이나, 이동평균선은 매도 신호를 나타내고 있어 단기적인 방향성에 대한 혼조세가 강합니다. $420 부근에서 지지선을 형성하려는 움직임이 관찰되지만, $442.90 저항선을 돌파하지 못하면 지속적인 박스권 등락이 예상됩니다."
  },
  "peers": [
    {
      "name": "BYD Company Ltd.",
      "symbol": "BYDDY",
      "price": 12.46,
      "performance": "최근 주간 하락세이나, 지난 12개월간 H-share는 5.05% 상승. '매수' 컨센서스.",
      "diffReason": "중국 시장 점유율 1위의 강력한 EV 경쟁자, 배터리 및 통합 생산 강점."
    },
    {
      "name": "Nio Inc.",
      "symbol": "NIO",
      "price": 4.59,
      "performance": "최근 3.27% 하락. 애널리스트 '보유' 컨센서스.",
      "diffReason": "프리미엄 스마트 EV 시장 공략, 배터리 스왑 기술 등 혁신 추구. 중국 시장에 집중."
    },
    {
      "name": "Lucid Group Inc.",
      "symbol": "LCID",
      "price": 11.07,
      "performance": "최근 1.54% 하락. 2025년 생산량 전망 하향 조정 및 큰 손실 기록.",
      "diffReason": "럭셔리 EV 시장에 특화, 높은 성능과 디자인을 강조."
    },
    {
      "name": "Ford Motor Co.",
      "symbol": "F",
      "price": 13.88,
      "performance": "최근 소폭 하락. 2025년 4분기 EV 판매량 51.9% 감소.",
      "diffReason": "전통적인 자동차 제조사로 EV 전환 가속화, F-150 Lightning 등 픽업트럭 EV 시장 공략."
    },
    {
      "name": "General Motors Co.",
      "symbol": "GM",
      "price": 84,
      "performance": "최근 4분기 실적 호조 및 자사주 매입 발표로 9% 이상 상승. 애널리스트 '매수' 컨센서스.",
      "diffReason": "전통적인 자동차 제조사로 EV 및 자율주행 기술에 적극 투자, 강력한 SUV 및 트럭 포트폴리오."
    }
  ],
  "title": "테슬라(TSLA): 전기차 거인의 AI·로보틱스 전환, 성장통 속 미래 가치 재평가",
  "macroContext": "글로벌 전기차(EV) 시장은 전례 없는 성장기를 맞이했으나, 최근 몇 년간의 급격한 성장은 점차 둔화되고 있으며, 공급망 안정화와 더불어 치열한 가격 경쟁이 심화되고 있습니다. 특히 중국 기업들의 약진과 기존 완성차 업체들의 EV 전환 가속화는 시장 경쟁 구도를 근본적으로 변화시키고 있습니다. 이러한 환경 속에서 인공지능(AI)과 로보틱스 기술은 산업 전반의 패러다임을 전환할 핵심 동력으로 부상하고 있으며, 자율주행 기술은 자동차 산업의 미래를 결정할 핵심 요소로 자리매김하고 있습니다. 높은 금리와 인플레이션 압박은 소비심리를 위축시키고 투자 환경의 불확실성을 가중시키는 거시 경제적 요인으로 작용하고 있습니다. 에너지 전환에 대한 전 세계적인 노력은 재생에너지 및 배터리 기술 혁신에 대한 투자를 촉진하고 있으며, 이는 테슬라와 같은 기업들에게 중장기적인 성장 기회를 제공하지만, 동시에 기술 개발 및 상용화에 대한 막대한 자본 지출을 요구하고 있습니다. 전반적인 시장의 탐욕 지수가 63.31로 '탐욕' 수준을 유지하고 있어 투자심리는 우호적이나, 개별 기업의 펀더멘털과 성장성에 대한 옥석 가리기는 더욱 심화되고 있습니다.",
  "valuationCheck": "테슬라(TSLA)의 현재 주가는 439.74 USD로, 제시된 목표주가 409.58 USD를 상회하고 있습니다. 이는 애널리스트 컨센서스 기반의 목표주가 대비 현재 시장이 프리미엄을 부여하고 있거나, 혹은 목표주가가 최근의 긍정적인 모멘텀(AI/로보틱스, SpaceX 합병 논의)을 충분히 반영하지 못했을 가능성을 시사합니다. '매수' 등급은 중장기적인 관점에서 주가 상승 여력이 있다고 판단하지만, 현재 주가가 목표주가를 넘어서고 있다는 점은 단기적인 조정 가능성을 배제할 수 없음을 의미합니다. 테슬라는 전통적인 밸류에이션 지표로는 설명하기 어려운 고성장 기술주로 분류되며, 미래 성장성, 특히 AI 및 로보틱스 부문의 잠재력에 대한 기대감이 주가에 상당 부분 반영되어 있습니다. 광범위한 시장의 '탐욕(Fear & Greed Index: 63.31)' 속에서 테슬라 주가는 혼조세를 보이며 단기적으로 방향성을 탐색하고 있습니다. 이는 전기차 본업의 성장 둔화 우려와 신사업에 대한 기대감이 복합적으로 작용한 결과로 해석됩니다. 높은 변동성과 'High' 리스크 레벨은 투자자들이 테슬라의 밸류에이션을 평가함에 있어 미래 성장 동력의 실현 가능성과 전기차 시장의 단기적 리스크를 동시에 고려해야 함을 나타냅니다. 특히 2025년 연간 매출 감소 및 차량 인도량 둔화 전망은 단기적 실적 압박을 가중시키지만, 로봇택시, Optimus 로봇 등 AI 및 로보틱스 사업으로의 성공적인 전환은 장기적인 밸류에이션 리레이팅의 핵심 동력이 될 것입니다.",
  "fullContent": "## 1. 서론: 테슬라, 전기차를 넘어선 미래 비전 제시\n\n테슬라(TSLA)는 단순한 전기차 제조사를 넘어 인공지능(AI) 및 로보틱스 기술을 기반으로 한 미래 모빌리티 및 에너지 솔루션 기업으로의 전환을 가속화하고 있습니다. 일론 머스크 최고경영자(CEO)는 로봇택시, 휴머노이드 로봇 '옵티머스(Optimus)' 등 AI 기반 신사업에 집중하며 테슬라의 장기적인 성장 동력을 재정의하고 있습니다. 최근에는 스페이스X(SpaceX)와의 잠재적 합병 논의가 보도되면서 시장의 기대감을 한층 고조시키고 있습니다. 그러나 이러한 원대한 비전 속에서도 전기차 시장의 경쟁 심화, 마진 압박, 그리고 연간 매출 및 차량 인도량 둔화와 같은 단기적인 도전 과제들이 상존하며, 주가는 높은 변동성 속에서 방향성을 모색하고 있습니다. 본 보고서는 테슬라의 현재 사업 현황, 재무 성과, 주요 성장 동력 및 리스크 요인을 심층적으로 분석하고, 기술적 분석 및 경쟁사 비교를 통해 투자 전략 수립에 필요한 종합적인 관점을 제공하고자 합니다.\n\n## 2. 사업 개요 및 최근 동향\n\n테슬라는 전기차, 배터리 에너지 저장장치(ESS), 태양광 발전 시스템 등 친환경 에너지 솔루션과 더불어 자율주행 소프트웨어 분야를 선도하고 있습니다. 최근에는 이러한 핵심 역량을 바탕으로 로봇택시(Robotaxi) 서비스와 범용 휴머노이드 로봇 '옵티머스(Optimus)' 개발에 박차를 가하며 AI 및 로보틱스 분야로의 사업 확장을 천명했습니다.\n\n*   **전기차(EV) 사업**: 프리미엄 세단 모델 S/X부터 대중적인 모델 3/Y에 이르기까지 다양한 라인업을 보유하며 EV 시장을 선도해 왔습니다. 그러나 최근 몇 년간의 가격 인하 정책과 시장 경쟁 심화로 수익성 압박을 받고 있습니다.\n*   **에너지 사업**: '메가팩(Megapack)' 및 '파워월(Powerwall)' 등 대규모 에너지 저장장치와 가정용 태양광 발전 시스템을 통해 에너지 전환 시대의 핵심 플레이어로 자리매김하고 있습니다.\n*   **AI 및 로보틱스**: 완전 자율주행(FSD) 소프트웨어의 진화를 넘어, 사람의 개입 없이 운행되는 로봇택시와 단순 반복 업무를 넘어 복잡한 작업을 수행할 수 있는 옵티머스 로봇 개발은 테슬라의 장기적 성장 비전을 구현하는 핵심 축입니다.\n*   **SpaceX 합병 논의**: 구체화되지 않았으나, SpaceX와의 합병은 테슬라의 AI 및 로보틱스 기술을 우주 탐사 및 위성 통신 분야로 확장하고, 자본 조달 측면에서도 시너지를 창출할 수 있는 잠재적 기회로 평가됩니다.\n\n## 3. 재무 성과 및 실적 분석\n\n테슬라의 2025년 4분기 실적은 시장 예상치를 상회하는 모습을 보였으나, 연간 단위에서는 매출 감소 및 차량 인도량 둔화라는 도전적인 현실에 직면해 있습니다. 이는 전기차 시장의 구조적 변화와 치열해진 경쟁 환경을 반영합니다.\n\n*   **매출 및 인도량 둔화**: 전기차 수요 둔화와 가격 인하 경쟁으로 인해 2025년 연간 매출 감소 및 차량 인도량 증가율 둔화가 예상됩니다. 이는 단기적인 수익성 압박으로 이어질 수 있습니다.\n*   **마진 압박**: 공격적인 가격 인하 정책은 차량 판매량 유지에는 기여했으나, 단위당 마진 감소로 이어져 전반적인 수익성에 부정적인 영향을 미쳤습니다.\n*   **높은 자본 지출(CapEx)**: 로봇택시, 옵티머스, 신규 공장 건설 및 배터리 생산 능력 확충 등 AI 및 로보틱스 사업 확장을 위한 대규모 투자는 높은 자본 지출을 수반하며, 이는 단기적인 현금 흐름에 부담으로 작용할 수 있습니다.\n*   **긍정적 요인**: 그럼에도 불구하고, 소프트웨어(FSD) 및 에너지 부문의 성장은 전체 매출 구성에서 중요한 비중을 차지하며, 비교적 높은 마진율로 기업의 수익성을 지탱하는 역할을 하고 있습니다.\n\n## 4. 주요 성장 동력 및 기회 요인\n\n테슬라의 미래 성장은 전기차를 넘어선 새로운 사업 영역에서의 성공적인 전환에 달려 있습니다.\n\n*   **AI 및 로보틱스 기술의 선도적 지위**: 로봇택시와 옵티머스 로봇은 단순한 기술 개발을 넘어 새로운 산업 생태계를 창출할 잠재력을 가집니다. 자율주행 기술의 완성도를 높이고, 범용 로봇을 상업화하는 데 성공한다면 테슬라의 밸류에이션은 한 단계 레벨업 될 수 있습니다.\n*   **SpaceX와의 시너지**: 잠재적 합병은 테슬라가 우주 산업으로 진출하고, 스페이스X의 AI 및 로보틱스 역량을 강화하며, 장기적으로는 양사의 기술 및 자본 시너지를 통해 혁신적인 사업 모델을 창출할 수 있는 기회를 제공합니다.\n*   **신규 저가형 모델 출시**: 전기차 시장의 대중화를 위한 신규 저가형 모델 출시는 시장 점유율을 확대하고, 규모의 경제를 통해 원가 경쟁력을 강화할 수 있는 중요한 전략입니다.\n*   **배터리 기술 혁신**: 자체 배터리 생산 및 기술 혁신은 원가 절감과 성능 향상으로 이어져 경쟁 우위를 확보하고, 에너지 사업 부문의 성장을 가속화할 것입니다.\n\n## 5. 주요 리스크 요인 및 도전 과제\n\n테슬라의 높은 성장 잠재력 뒤에는 상당한 리스크 요인들이 존재합니다.\n\n*   **전기차 시장 경쟁 심화**: BYD, Nio, Lucid, Ford, GM 등 글로벌 완성차 업체 및 신생 EV 기업들의 공격적인 시장 진입과 기술 개발은 테슬라의 시장 점유율과 가격 결정력을 약화시키고 있습니다.\n*   **가격 인하 압력 및 마진 감소**: 치열한 경쟁 환경 속에서 지속적인 가격 인하 압력은 테슬라의 수익성에 직접적인 타격을 줄 수 있습니다.\n*   **AI 및 로보틱스 프로젝트 지연 또는 기대치 미달**: 로봇택시 및 옵티머스 로봇 개발은 아직 초기 단계에 있으며, 기술적 난이도가 매우 높습니다. 상용화 지연이나 기대치에 미치지 못하는 성능은 투자 심리에 부정적인 영향을 미칠 수 있습니다.\n*   **글로벌 경기 둔화 및 공급망 문제**: 전 세계적인 경기 침체 가능성과 지정학적 리스크로 인한 공급망 불안정은 생산 및 인도량에 차질을 초래할 수 있습니다.\n*   **규제 및 정치적 리스크**: 각국의 자율주행 관련 규제 변화와 전기차 보조금 정책 변동은 테슬라의 사업 전략에 큰 영향을 미 미칠 수 있습니다.\n\n## 6. 기술적 분석\n\n테슬라(TSLA)의 주가는 현재 $420~$445 범위 내에서 횡보하는 움직임을 보이고 있으며, 단기적인 방향성에 대한 혼조세가 강하게 나타납니다.\n\n*   **지지선(Support)**: $420 부근에서 강한 지지선을 형성하려는 움직임이 관찰됩니다. 이 레벨이 유지될 경우 추가적인 하락은 제한될 수 있습니다.\n*   **저항선(Resistance)**: $442.90 저항선을 돌파하지 못하고 있으며, 이 저항선 돌파 여부가 단기적인 상승 추세 전환의 중요한 지표가 될 것입니다.\n*   **추세(Trend)**: 현재는 명확한 상승 또는 하락 추세보다는 횡보(박스권) 움직임이 지배적입니다.\n*   **RSI (Relative Strength Index)**: 14일 RSI는 49.537로 중립적인 수준을 나타내며, 과매수/과매도 구간에 있지 않아 매수 또는 매도 압력이 어느 한쪽으로 치우치지 않고 있음을 시사합니다.\n*   **이동평균선(Moving Averages)**: 단기 이동평균선은 매도 신호를 나타내고 있어, 현재 주가가 단기적으로는 약세 압력을 받고 있음을 보여줍니다. 장기 이동평균선과의 교차점 또한 중요하게 관찰되어야 합니다.\n\n전반적으로 기술적 지표들은 테슬라 주가가 중요한 변곡점에 서 있음을 보여주며, $442.90 저항선 돌파 여부가 향후 주가 흐름을 결정할 핵심 요인이 될 것입니다.\n\n## 7. 경쟁사 분석\n\n테슬라의 경쟁 환경은 매우 다변화되어 있으며, 각 경쟁사는 고유한 강점과 시장 전략을 가지고 있습니다.\n\n| 경쟁사           | 심볼  | 현재가(USD) | 최근 성과 및 컨센서스                                                                 | 주요 차별점                                                                                                           |\n| :--------------- | :---- | :---------- | :------------------------------------------------------------------------------------ | :-------------------------------------------------------------------------------------------------------------------- |\n| BYD Company Ltd. | BYDDY | 12.46       | 최근 주간 하락세이나, 지난 12개월간 H-share는 5.05% 상승. '매수' 컨센서스.             | 중국 시장 점유율 1위의 강력한 EV 경쟁자, 배터리 및 통합 생산 강점. 폭넓은 라인업.                                   |\n| Nio Inc.         | NIO   | 4.59        | 최근 3.27% 하락. 애널리스트 '보유' 컨센서스.                                          | 프리미엄 스마트 EV 시장 공략, 배터리 스왑 기술 등 혁신 추구. 중국 시장에 집중.                                     |\n| Lucid Group Inc. | LCID  | 11.07       | 최근 1.54% 하락. 2025년 생산량 전망 하향 조정 및 큰 손실 기록.                        | 럭셔리 EV 시장에 특화, 높은 성능과 디자인을 강조. 고가 시장 집중.                                                     |\n| Ford Motor Co.   | F     | 13.88       | 최근 소폭 하락. 2025년 4분기 EV 판매량 51.9% 감소.                                    | 전통적인 자동차 제조사로 EV 전환 가속화, F-150 Lightning 등 픽업트럭 EV 시장 공략. 강력한 딜러 네트워크.           |\n| General Motors Co.| GM    | 84          | 최근 4분기 실적 호조 및 자사주 매입 발표로 9% 이상 상승. 애널리스트 '매수' 컨센서스. | 전통적인 자동차 제조사로 EV 및 자율주행 기술에 적극 투자, 강력한 SUV 및 트럭 포트폴리오. 안정적인 재무 구조. |\n\n## 8. 투자 의견 및 시나리오 분석\n\n테슬라에 대한 투자 의견은 '매수(Buy)'로 제시되었으나, 높은 리스크 레벨(High)과 변동성을 고려할 때 신중한 접근이 필요합니다. 목표주가 409.58 USD는 현재가 대비 하회하지만, 이는 AI 및 로보틱스, SpaceX 시너지 등 미래 성장 동력에 대한 시장의 높은 기대감을 완전히 반영하지 못했을 가능성이 있습니다.\n\n*   **Bull 시나리오 (주가 상승 가능성)**\n    *   **자율주행 및 로보틱스 기술의 성공적인 개발 및 상용화**: 로봇택시의 대규모 서비스 개시와 옵티머스 로봇의 산업 현장 적용 성공은 테슬라의 수익 모델을 다각화하고, 폭발적인 성장을 견인할 것입니다. 이는 '기술 기업'으로서의 밸류에이션 리레이팅으로 이어질 수 있습니다.\n    *   **SpaceX와의 시너지 창출**: 합병 또는 긴밀한 협력을 통해 양사의 기술 및 자본 시너지가 극대화될 경우, 테슬라의 사업 영역이 우주 및 통신 분야로 확장되어 새로운 성장 기회를 창출할 수 있습니다.\n    *   **신규 저가형 모델 출시를 통한 시장 점유율 확대**: 25,000 USD 수준의 저가형 모델이 성공적으로 출시되어 대량 생산 체제를 갖추면, 전기차 시장에서의 경쟁 우위를 재확보하고 매출 성장을 다시 가속화할 수 있습니다.\n    *   **배터리 기술 혁신을 통한 원가 경쟁력 확보**: 4680 배터리 등 자체 배터리 기술의 발전은 생산 원가를 절감하고, 에너지 사업 부문의 수익성을 개선하여 기업 가치를 높일 것입니다.\n\n*   **Bear 시나리오 (주가 하락 압력)**\n    *   **전기차 시장의 경쟁 심화와 수요 둔화 지속**: 글로벌 전기차 시장의 포화와 가격 경쟁 심화로 인해 테슬라의 마진 압박이 가중되고, 시장 점유율이 추가적으로 하락할 경우 수익성이 악화될 수 있습니다.\n    *   **AI 및 로보틱스 프로젝트의 지연 또는 기대치 미달**: 로봇택시 및 옵티머스 로봇 개발이 예상보다 지연되거나, 기술적 난관에 부딪혀 상용화에 실패할 경우, 현재 주가에 반영된 미래 성장 프리미엄이 상당 부분 소멸될 수 있습니다.\n    *   **글로벌 경기 둔화 및 공급망 문제 장기화**: 고금리, 고물가 환경 속에서 소비 심리가 더욱 위축되고, 지정학적 리스크로 인한 핵심 부품 공급 차질이 장기화될 경우 생산 및 인도량 목표 달성이 어려워져 실적에 부정적인 영향을 미 미칠 수 있습니다.\n    *   **일론 머스크 리스크**: CEO의 잦은 구설수와 경영 방식에 대한 불확실성은 투자 심리에 지속적인 부담을 줄 수 있습니다.\n\n## 9. 결론 및 전략적 제언\n\n테슬라는 전기차 시장의 선두주자로서 입지를 확고히 해왔으나, 현재는 AI 및 로보틱스 기업으로의 대전환을 시도하며 새로운 성장 모멘텀을 모색하는 중요한 기로에 서 있습니다. 단기적으로는 전기차 시장의 경쟁 심화와 수익성 압박, 높은 자본 지출 등의 도전 과제에 직면해 있으나, 로봇택시, 옵티머스 로봇, SpaceX와의 잠재적 시너지 등 미래 성장 동력에 대한 기대감은 여전히 강력합니다. '매수' 의견과 높은 리스크 레벨은 이러한 양면성을 반영하며, 투자자들에게는 신중한 접근과 장기적인 관점이 요구됩니다.\n\n**전략적 제언:**\n\n*   **장기적 관점 유지**: 테슬라의 AI 및 로보틱스 비전은 장기적인 관점에서 접근해야 할 투자 테마입니다. 단기적인 주가 변동성에 일희일비하기보다는, 핵심 기술 개발 및 상용화 진행 상황을 면밀히 주시해야 합니다.\n*   **신사업 진행 상황 모니터링**: 로봇택시의 규제 승인 및 서비스 출시 시점, 옵티머스 로봇의 개발 진척도 및 실제 적용 사례 등 신사업의 구체적인 성과 지표를 지속적으로 모니터링해야 합니다.\n*   **전기차 사업의 마진 개선 여부 확인**: 신규 저가형 모델 출시 및 배터리 기술 혁신을 통해 전기차 사업의 마진 압박이 완화되고 수익성이 회복되는지를 확인하는 것이 중요합니다.\n*   **분산 투자 고려**: 테슬라의 높은 변동성과 리스크 레벨을 감안하여, 포트폴리오 내에서 적절한 비중을 유지하고 다른 자산군과의 분산 투자를 통해 리스크를 관리하는 것이 현명합니다.\n\n테슬라의 미래는 전기차를 넘어선 AI와 로보틱스 혁신에 달려 있습니다. 이 거대한 전환의 과정에서 발생하는 성장통을 극복하고 성공적으로 안착한다면, 테슬라는 다시 한번 시장의 예상을 뛰어넘는 기업 가치를 창출할 수 있을 것입니다. 그러나 그 과정은 험난할 것이며, 투자자들은 철저한 분석과 인내심을 가지고 접근해야 할 것입니다.",
  "faqs": [
    {
      "question": "테슬라의 최근 실적 동향은 어떻고, 이는 주가에 어떤 영향을 미 미칠까요?",
      "answer": "테슬라는 2025년 4분기 실적이 예상치를 상회했음에도 불구하고, 연간 매출 감소와 차량 인도량 둔화라는 도전 과제에 직면해 있습니다. 이는 전기차 시장의 경쟁 심화와 가격 인하 압력으로 인한 마진 감소가 주된 원인입니다. 단기적으로는 이러한 실적 우려가 주가 상승에 부담으로 작용할 수 있으나, AI 및 로보틱스, SpaceX와의 잠재적 합병 논의 등 미래 성장 동력에 대한 기대감이 상존하여 주가는 혼조세를 보이고 있습니다. 장기적으로는 신사업의 성공 여부가 주가 흐름을 결정할 핵심 요인이 될 것입니다."
    },
    {
      "question": "테슬라가 추진하는 AI 및 로보틱스 사업(로봇택시, Optimus)의 성공 가능성은 어떻게 보십니까?",
      "answer": "테슬라의 AI 및 로보틱스 사업은 매우 높은 잠재력을 가지고 있지만, 기술적 난이도와 상용화 과정에서 상당한 도전 과제가 예상됩니다. 로봇택시는 규제 문제와 기술적 안정성 확보가 관건이며, 옵티머스 로봇은 범용성 확보와 대량 생산 능력 구축이 중요합니다. 이들 사업이 성공적으로 시장에 안착한다면 테슬라의 수익 모델을 혁신하고 기업 가치를 크게 끌어올릴 수 있겠지만, 프로젝트 지연이나 기대치 미달 시에는 투자 심리에 부정적인 영향을 줄 수 있는 고위험-고수익 사업으로 평가됩니다."
    },
    {
      "question": "테슬라의 주가가 현재 목표주가를 상회하고 있는데, '매수' 의견은 유효한가요?",
      "answer": "테슬라의 현재 주가(439.74 USD)가 제시된 목표주가(409.58 USD)를 상회하고 있다는 점은 주목해야 할 부분입니다. '매수' 의견은 중장기적인 관점에서 테슬라의 AI 및 로보틱스 사업, SpaceX와의 시너지 등 미래 성장 동력에 대한 잠재력을 높이 평가한 결과로 보입니다. 그러나 현재 주가가 목표주가 대비 프리미엄을 형성하고 있는 만큼, 단기적인 투자자들은 조정 가능성을 염두에 두어야 합니다. 장기적인 관점에서 신사업의 가시적인 성과가 나타나고, 전기차 본업의 마진 압박이 완화될 경우 추가적인 밸류에이션 리레이팅이 가능할 것입니다. 높은 리스크 레벨을 고려하여 신중한 접근과 포트폴리오 분산이 권장됩니다."
    }
  ],
  "chartData": [],
  "market": "US",
  "id": "report-1769884340234",
  "timestamp": "2026-01-31T18:32:20.234Z"
}